{
  "$schema": "https://json-schema.org/draft/2020-12/schema",
  "additionalProperties": false,
  "properties": {
    "contract_version": {
      "const": "inventory-projection-config-1.0.0",
      "title": "Contract Version",
      "type": "string"
    },
    "process_version": {
      "const": "inventory-projection-1.0.0",
      "title": "Process Version",
      "type": "string"
    },
    "business_timezone": {
      "const": "UTC",
      "title": "Business Timezone",
      "type": "string"
    },
    "start_at": {
      "pattern": "^\\d{4}-\\d{2}-\\d{2}T\\d{2}:\\d{2}:\\d{2}(?:\\.\\d{1,6})?(?:Z|\\+00:00)$",
      "title": "Start At",
      "type": "string"
    },
    "end_at": {
      "pattern": "^\\d{4}-\\d{2}-\\d{2}T\\d{2}:\\d{2}:\\d{2}(?:\\.\\d{1,6})?(?:Z|\\+00:00)$",
      "title": "End At",
      "type": "string"
    },
    "snapshot_policy": {
      "const": "utc_day_last_microsecond",
      "title": "Snapshot Policy",
      "type": "string"
    },
    "reservation_policy": {
      "const": "none",
      "title": "Reservation Policy",
      "type": "string"
    },
    "stock_measure": {
      "const": "available_qty",
      "title": "Stock Measure",
      "type": "string"
    },
    "episode_policy": {
      "const": "zero_after_event_including_instantaneous",
      "title": "Episode Policy",
      "type": "string"
    },
    "diagnostic_horizon_days": {
      "const": 7,
      "title": "Diagnostic Horizon Days",
      "type": "integer"
    },
    "truth_delay_seconds": {
      "minimum": 0,
      "title": "Truth Delay Seconds",
      "type": "integer"
    }
  },
  "required": [
    "contract_version",
    "process_version",
    "business_timezone",
    "start_at",
    "end_at",
    "snapshot_policy",
    "reservation_policy",
    "stock_measure",
    "episode_policy",
    "diagnostic_horizon_days",
    "truth_delay_seconds"
  ],
  "title": "ProjectionConfig",
  "type": "object"
}
